{"command":"'C:\\VV\\PyMoneyMaker\\brullik-bybit-grid-bot-research\\benchmarks\\real_market_skew.py' --instrument-inventory benchmarks/results/m1-bybit-public-inventory.json --work-dir .benchmark-work/real-market-skew --start-ms 1782864000000 --end-ms 1783468740000 --sample-size 8 --row-group-rows 100000 --output benchmarks/results/m1-real-market-layout-skew.json","content_sha256":"8425c446786bf4fc5493a810feff23519c8519bdf05e1ecacabb94541c0e7b72","decision_evidence":{"artifact":"m1-layout-exact-decision-candidate.json","artifact_sha256":"c8bbb632413bbc2147c42dfc375139776339bcbf598f67c693d55d64d9047d15","benchmark_schema":"grid.layout-benchmark/v3","status":"decision-matrix-candidate"},"distribution":{"distinct_close_count":19590,"maximum_price":"64703.2","maximum_price_decimal_places":6,"maximum_turnover":"223184086.8834","maximum_turnover_decimal_places":6,"maximum_volume":"953643900","maximum_volume_decimal_places":3,"minimum_price":"0.003998","minimum_turnover":"0","minimum_volume":"0","price_dynamic_range":"16183891.94597298649324662331","zero_turnover_count":6259,"zero_volume_count":6259},"evidence_schema":"grid.real-market-layout-skew/v1","fetched_at_utc":"2026-08-12T10:27:07.867763Z","hardware":{"machine":"AMD64","platform":"Windows-10-10.0.19044-SP0"},"inventory_evidence":{"artifact":"m1-bybit-public-inventory.json","artifact_sha256":"ae38b3536e3949282a76287192ae4af02b648fe4dc9946765c4812a78b3e286e","evidence_schema":"grid.bybit-public-inventory/v1","fetched_at_utc":"2026-08-12T05:03:32.237874Z"},"layouts":[{"bucket_row_count_max":50400,"bucket_row_count_min":10080,"bytes_per_row":"25.032130456","exact_schema_verified":true,"file_count":3,"layout":{"bucket_count":4,"compression":"zstd","compression_level":3,"numeric_representation":"hybrid_int64_decimal","target_file_mb":32},"logical_summary":{"duckdb_polars_equal":true,"logical_sha256":"f9f1e38afb14292679fd03ac02358f3e8a5e49ca07198bd6b15d74bbfd3d4f28","row_count":80640},"total_bytes":2018591,"tree_sha256":"37ea06ecfd2e06c3ba7079b2bf87a5a9a10c823f5d6472b532b7d6470667cb03"},{"bucket_row_count_max":30240,"bucket_row_count_min":10080,"bytes_per_row":"25.420957341","exact_schema_verified":true,"file_count":5,"layout":{"bucket_count":8,"compression":"zstd","compression_level":3,"numeric_representation":"hybrid_int64_decimal","target_file_mb":16},"logical_summary":{"duckdb_polars_equal":true,"logical_sha256":"f9f1e38afb14292679fd03ac02358f3e8a5e49ca07198bd6b15d74bbfd3d4f28","row_count":80640},"total_bytes":2049946,"tree_sha256":"22907d0574b5ad4bcfbfd360749defe578bd90f347e9495c58dfbd827b4be442"}],"limitations":["Current ticker liquidity selected a bounded historical compression sample and is not decision-time universe evidence.","The sample covers at most seven days and cannot represent all historical volatility regimes.","Only trade-price candle physical layouts are measured; mark-price rows have a different logical column set.","Raw rows and Parquet files remain outside Git; the public artifact retains content and tree hashes only.","This evidence cannot decide P-001 through P-005 or close Gate 1 without the reference-host protocol and owner/PM acceptance."],"per_symbol":[{"close_max":"0.005155","close_min":"0.004019","content_sha256":"ef8167c767cf7f63240a45d37542fb060ee45a74748b16675ad330ef8a80771e","instrument_id":264,"row_count":10080,"symbol":"1000BONKUSDT"},{"close_max":"315.58","close_min":"288.68","content_sha256":"ad1ef30a18fe36f639b3cd590712094dcc939b852c4d414b402b0651e8ceb96c","instrument_id":2640,"row_count":10080,"symbol":"AAPLUSDT"},{"close_max":"0.08199","close_min":"0.07522","content_sha256":"365ef7772877609a1e29b34c452605b21954f7dc8a552938e79bc9417f61aea3","instrument_id":305,"row_count":10080,"symbol":"ARBUSDT"},{"close_max":"0.01724","close_min":"0.01398","content_sha256":"b853bd3053bd6b48bdfebc800be90a774714617e2b59245425daab7af10f09df","instrument_id":132,"row_count":10080,"symbol":"BICOUSDT"},{"close_max":"64494.4","close_min":"57847","content_sha256":"7d43ed75945444527af4713e796f2075d8e59dc0edaff62107beced4a59fccc4","instrument_id":5,"row_count":10080,"symbol":"BTCUSDT"},{"close_max":"2.7519","close_min":"1.7506","content_sha256":"0744397c5528912991e2e9e0dda92e30d4d9a3485048e07e7ca882b3096bc3e4","instrument_id":124,"row_count":10080,"symbol":"LITUSDT"},{"close_max":"83.92","close_min":"72.35","content_sha256":"9f36c401a45d8effa978c3ecb186d4a9de4b7fa5d909c6d301a7fb3c209a4fab","instrument_id":38,"row_count":10080,"symbol":"SOLUSDT"},{"close_max":"0.33287","close_min":"0.31386","content_sha256":"1d8bab3afcdad7ed9da54c30c596fe3728c23334af2fa5024b940c026dcfaa01","instrument_id":40,"row_count":10080,"symbol":"TRXUSDT"}],"raw_storage_policy":"ignored operator work directory; never committed","request":{"category":"linear","closed_candles_only":true,"end_ms":1783468740000,"endpoint":"/v5/market/kline","expected_rows_per_symbol":10080,"interval":"1","start_ms":1782864000000},"selection":{"eligible_instrument_count":590,"liquid_pool_size":80,"observed_ticker_endpoint":"/v5/market/tickers","pool_ranking":"turnover_24h_desc,symbol_asc","selected":[{"instrument_id":264,"launch_time_ms":1672971039000,"mark_price":"0.002275","symbol":"1000BONKUSDT","turnover_24h":"10596654.6844"},{"instrument_id":132,"launch_time_ms":1638445217000,"mark_price":"0.032942","symbol":"BICOUSDT","turnover_24h":"10294338.609"},{"instrument_id":305,"launch_time_ms":1679563660000,"mark_price":"0.07873","symbol":"ARBUSDT","turnover_24h":"8490919.0006"},{"instrument_id":40,"launch_time_ms":1628726400000,"mark_price":"0.337","symbol":"TRXUSDT","turnover_24h":"10066506.5412"},{"instrument_id":124,"launch_time_ms":1767089298000,"mark_price":"2.3093","symbol":"LITUSDT","turnover_24h":"11064867.7621"},{"instrument_id":38,"launch_time_ms":1634256000000,"mark_price":"76.766","symbol":"SOLUSDT","turnover_24h":"431294104.187"},{"instrument_id":2640,"launch_time_ms":1777364510000,"mark_price":"305.5","symbol":"AAPLUSDT","turnover_24h":"43683033.0489"},{"instrument_id":5,"launch_time_ms":1584230400000,"mark_price":"64046.68","symbol":"BTCUSDT","turnover_24h":"3468184681.5239"}],"selected_price_rank_indices":[0,11,22,33,45,56,67,79],"selection":"even exact-mark-price ranks across the liquid pool"},"source_content_sha256":"db31a9ddf4a603d36c5c4f859ea1fd15e878b1e026326d550d8c084452b0b84e","status":"complete-bounded-real-market-skew","total_row_count":80640,"work_evidence":{"artifact":"run.json","artifact_sha256":"7fe886f949e9d9da1f6ad96e720b2159e3724543eba992fc873702e776c167a6","work_schema":"grid.real-market-layout-skew-work/v1"}}
